PassengerId,Survived,Pclass,Name,Sex,Age,Title,IsMarried,SibSp,Parch,FamilySize,Fare,FareGroup,Cabin,Deck,Embarked,AgeGroup
981,0,2,"Wells, Master. Ralph Lester",male,2.0,Master,0,1,1,3,23.0,High,,T,S,Infant
982,1,3,"Dyker, Mrs. Adolf Fredrik (Anna Elisabeth Judith Andersson)",female,22.0,Mrs,1,1,0,2,13.9,Medium,,T,S,Young Adult
983,0,3,"Pedersen, Mr. Olaf",male,25.0,Mr,0,0,0,1,7.775,Low,,T,S,Unknown
984,1,1,"Davidson, Mrs. Thornton (Orian Hays)",female,27.0,Mrs,1,1,2,4,52.0,Very High,B71,B,S,Young Adult
985,0,3,"Guest, Mr. Robert",male,25.0,Mr,0,0,0,1,8.05,Medium,,T,S,Unknown
986,0,1,"Birnbaum, Mr. Jakob",male,25.0,Mr,0,0,0,1,26.0,High,,T,C,Young Adult
987,0,3,"Tenglin, Mr. Gunnar Isidor",male,25.0,Mr,0,0,0,1,7.7958,Low,,T,S,Young Adult
988,1,1,"Cavendish, Mrs. Tyrell William (Julia Florence Siegel)",female,76.0,Mrs,1,1,0,2,78.85,Very High,C46,C,S,Senior
989,0,3,"Makinen, Mr. Kalle Edvard",male,29.0,Mr,0,0,0,1,7.925,Medium,,T,S,Young Adult
990,1,3,"Braf, Miss. Elin Ester Maria",female,20.0,Miss,0,0,0,1,7.8542,Low,,T,S,Young Adult
991,0,3,"Nancarrow, Mr. William Henry",male,33.0,Mr,0,0,0,1,8.05,Medium,,T,S,Young Adult
992,1,1,"Stengel, Mrs. Charles Emil Henry (Annie May Morris)",female,43.0,Mrs,1,1,0,2,55.4417,Very High,C116,C,C,Adult
993,0,2,"Weisz, Mr. Leopold",male,27.0,Mr,0,1,0,2,26.0,High,,T,S,Young Adult
994,0,3,"Foley, Mr. William",male,25.0,Mr,0,0,0,1,7.75,Low,,T,Q,Unknown
995,0,3,"Johansson Palmquist, Mr. Oskar Leander",male,26.0,Mr,0,0,0,1,7.775,Low,,T,S,Young Adult
996,1,3,"Thomas, Mrs. Alexander (Thamine Thelma"")""",female,16.0,Mrs,1,1,1,3,8.5167,Medium,,T,C,Teenager
997,0,3,"Holthen, Mr. Johan Martin",male,28.0,Mr,0,0,0,1,22.525,High,,T,S,Young Adult
998,0,3,"Buckley, Mr. Daniel",male,21.0,Mr,0,0,0,1,7.8208,Low,,T,Q,Young Adult
999,0,3,"Ryan, Mr. Edward",male,25.0,Mr,0,0,0,1,7.75,Low,,T,Q,Unknown
1000,0,3,"Willer, Mr. Aaron (Abi Weller"")""",male,25.0,Mr,0,0,0,1,8.7125,Medium,,T,S,Unknown
1001,0,2,"Swane, Mr. George",male,18.5,Mr,0,0,0,1,13.0,Medium,F,F,S,Young Adult
1002,0,2,"Stanton, Mr. Samuel Ward",male,41.0,Mr,0,0,0,1,15.0458,High,,T,C,Adult
1003,1,3,"Shine, Miss. Ellen Natalia",female,24.0,Miss,0,0,0,1,7.7792,Low,,T,Q,Unknown
1004,1,1,"Evans, Miss. Edith Corse",female,36.0,Miss,0,0,0,1,31.6792,Very High,A29,A,C,Adult
1005,1,3,"Buckley, Miss. Katherine",female,18.5,Miss,0,0,0,1,7.2833,Low,,T,Q,Young Adult
1006,1,1,"Straus, Mrs. Isidor (Rosalie Ida Blun)",female,63.0,Mrs,1,1,0,2,221.7792,Very High,C55 C57,C,S,Middle-aged
1007,0,3,"Chronopoulos, Mr. Demetrios",male,18.0,Mr,0,1,0,2,14.4542,High,,T,C,Teenager
1008,0,3,"Thomas, Mr. John",male,25.0,Mr,0,0,0,1,6.4375,Low,,T,C,Unknown
1009,1,3,"Sandstrom, Miss. Beatrice Irene",female,1.0,Miss,0,1,1,3,16.7,High,G6,G,S,Infant
1010,0,1,"Beattie, Mr. Thomson",male,36.0,Mr,0,0,0,1,75.2417,Very High,C6,C,C,Adult
1011,1,2,"Chapman, Mrs. John Henry (Sara Elizabeth Lawry)",female,29.0,Mrs,1,1,0,2,26.0,High,,T,S,Young Adult
1012,1,2,"Watt, Miss. Bertha J",female,12.0,Miss,0,0,0,1,15.75,High,,T,S,Child
1013,0,3,"Kiernan, Mr. John",male,25.0,Mr,0,1,0,2,7.75,Low,,T,Q,Unknown
1014,1,1,"Schabert, Mrs. Paul (Emma Mock)",female,35.0,Mrs,1,1,0,2,57.75,Very High,C28,C,C,Young Adult
1015,0,3,"Carver, Mr. Alfred John",male,28.0,Mr,0,0,0,1,7.25,Low,,T,S,Young Adult
1016,0,3,"Kennedy, Mr. John",male,25.0,Mr,0,0,0,1,7.75,Low,,T,Q,Unknown
1017,1,3,"Cribb, Miss. Laura Alice",female,17.0,Miss,0,0,1,2,16.1,High,,T,S,Teenager
1018,0,3,"Brobeck, Mr. Karl Rudolf",male,22.0,Mr,0,0,0,1,7.7958,Low,,T,S,Young Adult
1019,1,3,"McCoy, Miss. Alicia",female,24.0,Miss,0,2,0,3,23.25,High,,T,Q,Unknown
1020,0,2,"Bowenur, Mr. Solomon",male,42.0,Mr,0,0,0,1,13.0,Medium,,T,S,Adult
1021,0,3,"Petersen, Mr. Marius",male,24.0,Mr,0,0,0,1,8.05,Medium,,T,S,Young Adult
1022,0,3,"Spinner, Mr. Henry John",male,32.0,Mr,0,0,0,1,8.05,Medium,,T,S,Young Adult
1023,0,1,"Gracie, Col. Archibald IV",male,53.0,Col,0,0,0,1,28.5,High,C51,C,C,Middle-aged
1024,1,3,"Lefebre, Mrs. Frank (Frances)",female,24.0,Mrs,1,0,4,5,25.4667,High,,T,S,Unknown
1025,0,3,"Thomas, Mr. Charles P",male,25.0,Mr,0,1,0,2,6.4375,Low,,T,C,Unknown
1026,0,3,"Dintcheff, Mr. Valtcho",male,43.0,Mr,0,0,0,1,7.8958,Low,,T,S,Adult
1027,0,3,"Carlsson, Mr. Carl Robert",male,24.0,Mr,0,0,0,1,7.8542,Low,,T,S,Young Adult
1028,0,3,"Zakarian, Mr. Mapriededer",male,26.5,Mr,0,0,0,1,7.225,Low,,T,C,Young Adult
1029,0,2,"Schmidt, Mr. August",male,26.0,Mr,0,0,0,1,13.0,Medium,,T,S,Young Adult
1030,1,3,"Drapkin, Miss. Jennie",female,23.0,Miss,0,0,0,1,8.05,Medium,,T,S,Young Adult
1031,0,3,"Goodwin, Mr. Charles Frederick",male,40.0,Mr,0,1,6,8,46.9,Very High,,T,S,Adult
1032,1,3,"Goodwin, Miss. Jessie Allis",female,10.0,Miss,0,5,2,8,46.9,Very High,,T,S,Child
1033,1,1,"Daniels, Miss. Sarah",female,33.0,Miss,0,0,0,1,151.55,Very High,,T,S,Young Adult
1034,0,1,"Ryerson, Mr. Arthur Larned",male,61.0,Mr,0,1,3,5,262.375,Very High,B57 B59 B63 B66,B,C,Middle-aged
1035,0,2,"Beauchamp, Mr. Henry James",male,28.0,Mr,0,0,0,1,26.0,High,,T,S,Young Adult
1036,0,1,"Lindeberg-Lind, Mr. Erik Gustaf (Mr Edward Lingrey"")""",male,42.0,Mr,0,0,0,1,26.55,High,,T,S,Adult
1037,0,3,"Vander Planke, Mr. Julius",male,31.0,Mr,0,3,0,4,18.0,High,,T,S,Young Adult
1038,0,1,"Hilliard, Mr. Herbert Henry",male,40.0,Mr,0,0,0,1,51.8625,Very High,E46,E,S,Unknown
1039,0,3,"Davies, Mr. Evan",male,22.0,Mr,0,0,0,1,8.05,Medium,,T,S,Young Adult
1040,0,1,"Crafton, Mr. John Bertram",male,40.0,Mr,0,0,0,1,26.55,High,,T,S,Unknown
1041,0,2,"Lahtinen, Rev. William",male,30.0,Rev,0,1,1,3,26.0,High,,T,S,Young Adult
1042,1,1,"Earnshaw, Mrs. Boulton (Olive Potter)",female,23.0,Mrs,1,0,1,2,83.1583,Very High,C54,C,C,Young Adult
1043,0,3,"Matinoff, Mr. Nicola",male,25.0,Mr,0,0,0,1,7.8958,Low,,T,C,Unknown
1044,0,3,"Storey, Mr. Thomas",male,60.5,Mr,0,0,0,1,33.5,Unknown,,T,S,Middle-aged
1045,1,3,"Klasen, Mrs. (Hulda Kristina Eugenia Lofqvist)",female,36.0,Mrs,1,0,2,3,12.1833,Medium,,T,S,Adult
1046,0,3,"Asplund, Master. Filip Oscar",male,13.0,Master,0,4,2,7,31.3875,Very High,,T,S,Teenager
1047,0,3,"Duquemin, Mr. Joseph",male,24.0,Mr,0,0,0,1,7.55,Low,,T,S,Young Adult
1048,1,1,"Bird, Miss. Ellen",female,29.0,Miss,0,0,0,1,221.7792,Very High,C97,C,S,Young Adult
1049,1,3,"Lundin, Miss. Olga Elida",female,23.0,Miss,0,0,0,1,7.8542,Low,,T,S,Young Adult
1050,0,1,"Borebank, Mr. John James",male,42.0,Mr,0,0,0,1,26.55,High,D22,D,S,Adult
1051,1,3,"Peacock, Mrs. Benjamin (Edith Nile)",female,26.0,Mrs,1,0,2,3,13.775,Medium,,T,S,Young Adult
1052,1,3,"Smyth, Miss. Julia",female,24.0,Miss,0,0,0,1,7.7333,Low,,T,Q,Unknown
1053,0,3,"Touma, Master. Georges Youssef",male,7.0,Master,0,1,1,3,15.2458,High,,T,C,Child
1054,1,2,"Wright, Miss. Marion",female,26.0,Miss,0,0,0,1,13.5,Medium,,T,S,Young Adult
1055,0,3,"Pearce, Mr. Ernest",male,25.0,Mr,0,0,0,1,7.0,Low,,T,S,Unknown
1056,0,2,"Peruschitz, Rev. Joseph Maria",male,41.0,Rev,0,0,0,1,13.0,Medium,,T,S,Adult
1057,1,3,"Kink-Heilmann, Mrs. Anton (Luise Heilmann)",female,26.0,Mrs,1,1,1,3,22.025,High,,T,S,Young Adult
1058,0,1,"Brandeis, Mr. Emil",male,48.0,Mr,0,0,0,1,50.4958,Very High,B10,B,C,Adult
1059,0,3,"Ford, Mr. Edward Watson",male,18.0,Mr,0,2,2,5,34.375,Very High,,T,S,Teenager
1060,1,1,"Cassebeer, Mrs. Henry Arthur Jr (Eleanor Genevieve Fosdick)",female,34.0,Mrs,1,0,0,1,27.7208,High,,T,C,Unknown
1061,1,3,"Hellstrom, Miss. Hilda Maria",female,22.0,Miss,0,0,0,1,8.9625,Medium,,T,S,Young Adult
1062,0,3,"Lithman, Mr. Simon",male,25.0,Mr,0,0,0,1,7.55,Low,,T,S,Unknown
1063,0,3,"Zakarian, Mr. Ortin",male,27.0,Mr,0,0,0,1,7.225,Low,,T,C,Young Adult
1064,0,3,"Dyker, Mr. Adolf Fredrik",male,23.0,Mr,0,1,0,2,13.9,Medium,,T,S,Young Adult
1065,0,3,"Torfa, Mr. Assad",male,25.0,Mr,0,0,0,1,7.2292,Low,,T,C,Unknown
1066,0,3,"Asplund, Mr. Carl Oscar Vilhelm Gustafsson",male,40.0,Mr,0,1,5,7,31.3875,Very High,,T,S,Adult
1067,1,2,"Brown, Miss. Edith Eileen",female,15.0,Miss,0,0,2,3,39.0,Very High,,T,S,Teenager
1068,1,2,"Sincock, Miss. Maude",female,20.0,Miss,0,0,0,1,36.75,Very High,,T,S,Young Adult
1069,0,1,"Stengel, Mr. Charles Emil Henry",male,54.0,Mr,0,1,0,2,55.4417,Very High,C116,C,C,Middle-aged
1070,1,2,"Becker, Mrs. Allen Oliver (Nellie E Baumgardner)",female,36.0,Mrs,1,0,3,4,39.0,Very High,F4,F,S,Adult
1071,1,1,"Compton, Mrs. Alexander Taylor (Mary Eliza Ingersoll)",female,64.0,Mrs,1,0,2,3,83.1583,Very High,E45,E,C,Middle-aged
1072,0,2,"McCrie, Mr. James Matthew",male,30.0,Mr,0,0,0,1,13.0,Medium,,T,S,Young Adult
1073,0,1,"Compton, Mr. Alexander Taylor Jr",male,37.0,Mr,0,1,1,3,83.1583,Very High,E52,E,C,Adult
1074,1,1,"Marvin, Mrs. Daniel Warner (Mary Graham Carmichael Farquarson)",female,18.0,Mrs,1,1,0,2,53.1,Very High,D30,D,S,Teenager
1075,0,3,"Lane, Mr. Patrick",male,25.0,Mr,0,0,0,1,7.75,Low,,T,Q,Unknown
1076,1,1,"Douglas, Mrs. Frederick Charles (Mary Helene Baxter)",female,27.0,Mrs,1,1,1,3,247.5208,Very High,B58 B60,B,C,Young Adult
1077,0,2,"Maybery, Mr. Frank Hubert",male,40.0,Mr,0,0,0,1,16.0,High,,T,S,Adult
1078,1,2,"Phillips, Miss. Alice Frances Louisa",female,21.0,Miss,0,0,1,2,21.0,High,,T,S,Young Adult
1079,0,3,"Davies, Mr. Joseph",male,17.0,Mr,0,2,0,3,8.05,Medium,,T,S,Teenager
1080,1,3,"Sage, Miss. Ada",female,24.0,Miss,0,8,2,11,69.55,Very High,,T,S,Unknown
1081,0,2,"Veal, Mr. James",male,40.0,Mr,0,0,0,1,13.0,Medium,,T,S,Adult
1082,0,2,"Angle, Mr. William A",male,34.0,Mr,0,1,0,2,26.0,High,,T,S,Young Adult
1083,0,1,"Salomon, Mr. Abraham L",male,40.0,Mr,0,0,0,1,26.0,High,,T,S,Unknown
1084,0,3,"van Billiard, Master. Walter John",male,11.5,Master,0,1,1,3,14.5,High,,T,S,Child
1085,0,2,"Lingane, Mr. John",male,61.0,Mr,0,0,0,1,12.35,Medium,,T,Q,Middle-aged
1086,0,2,"Drew, Master. Marshall Brines",male,8.0,Master,0,0,2,3,32.5,Very High,,T,S,Child
1087,0,3,"Karlsson, Mr. Julius Konrad Eugen",male,33.0,Mr,0,0,0,1,7.8542,Low,,T,S,Young Adult
1088,0,1,"Spedden, Master. Robert Douglas",male,6.0,Master,0,0,2,3,134.5,Very High,E34,E,C,Child
1089,1,3,"Nilsson, Miss. Berta Olivia",female,18.0,Miss,0,0,0,1,7.775,Low,,T,S,Teenager
1090,0,2,"Baimbrigge, Mr. Charles Robert",male,23.0,Mr,0,0,0,1,10.5,Medium,,T,S,Young Adult
1091,1,3,"Rasmussen, Mrs. (Lena Jacobsen Solvang)",female,24.0,Mrs,1,0,0,1,8.1125,Medium,,T,S,Unknown
1092,1,3,"Murphy, Miss. Nora",female,24.0,Miss,0,0,0,1,15.5,High,,T,Q,Unknown
1093,0,3,"Danbom, Master. Gilbert Sigvard Emanuel",male,0.33,Master,0,0,2,3,14.4,Medium,,T,S,Infant
1094,0,1,"Astor, Col. John Jacob",male,47.0,Col,0,1,0,2,227.525,Very High,C62 C64,C,C,Adult
1095,1,2,"Quick, Miss. Winifred Vera",female,8.0,Miss,0,1,1,3,26.0,High,,T,S,Child
1096,0,2,"Andrew, Mr. Frank Thomas",male,25.0,Mr,0,0,0,1,10.5,Medium,,T,S,Young Adult
1097,0,1,"Omont, Mr. Alfred Fernand",male,40.0,Mr,0,0,0,1,25.7417,High,,T,C,Unknown
1098,1,3,"McGowan, Miss. Katherine",female,35.0,Miss,0,0,0,1,7.75,Low,,T,Q,Young Adult
1099,0,2,"Collett, Mr. Sidney C Stuart",male,24.0,Mr,0,0,0,1,10.5,Medium,,T,S,Young Adult
1100,1,1,"Rosenbaum, Miss. Edith Louise",female,33.0,Miss,0,0,0,1,27.7208,High,A11,A,C,Young Adult
1101,0,3,"Delalic, Mr. Redjo",male,25.0,Mr,0,0,0,1,7.8958,Low,,T,S,Young Adult
1102,0,3,"Andersen, Mr. Albert Karvin",male,32.0,Mr,0,0,0,1,22.525,High,,T,S,Young Adult
1103,0,3,"Finoli, Mr. Luigi",male,25.0,Mr,0,0,0,1,7.05,Low,,T,S,Unknown
1104,0,2,"Deacon, Mr. Percy William",male,17.0,Mr,0,0,0,1,73.5,Very High,,T,S,Teenager
1105,1,2,"Howard, Mrs. Benjamin (Ellen Truelove Arman)",female,60.0,Mrs,1,1,0,2,26.0,High,,T,S,Middle-aged
1106,1,3,"Andersson, Miss. Ida Augusta Margareta",female,38.0,Miss,0,4,2,7,7.775,Low,,T,S,Adult
1107,0,1,"Head, Mr. Christopher",male,42.0,Mr,0,0,0,1,42.5,Very High,B11,B,S,Adult
1108,1,3,"Mahon, Miss. Bridget Delia",female,24.0,Miss,0,0,0,1,7.8792,Low,,T,Q,Unknown
1109,0,1,"Wick, Mr. George Dennick",male,57.0,Mr,0,1,1,3,164.8667,Very High,,T,S,Middle-aged
1110,1,1,"Widener, Mrs. George Dunton (Eleanor Elkins)",female,50.0,Mrs,1,1,1,3,211.5,Very High,C80,C,C,Adult
1111,0,3,"Thomson, Mr. Alexander Morrison",male,25.0,Mr,0,0,0,1,8.05,Medium,,T,S,Unknown
1112,1,2,"Duran y More, Miss. Florentina",female,30.0,Miss,0,1,0,2,13.8583,Medium,,T,C,Young Adult
1113,0,3,"Reynolds, Mr. Harold J",male,21.0,Mr,0,0,0,1,8.05,Medium,,T,S,Young Adult
1114,1,2,"Cook, Mrs. (Selena Rogers)",female,22.0,Mrs,1,0,0,1,10.5,Medium,F33,F,S,Young Adult
1115,0,3,"Karlsson, Mr. Einar Gervasius",male,21.0,Mr,0,0,0,1,7.7958,Low,,T,S,Young Adult
1116,1,1,"Candee, Mrs. Edward (Helen Churchill Hungerford)",female,53.0,Mrs,1,0,0,1,27.4458,High,,T,C,Middle-aged
1117,1,3,"Moubarek, Mrs. George (Omine Amenia"" Alexander)""",female,24.0,Mrs,1,0,2,3,15.2458,High,,T,C,Unknown
1118,0,3,"Asplund, Mr. Johan Charles",male,23.0,Mr,0,0,0,1,7.7958,Low,,T,S,Young Adult
1119,1,3,"McNeill, Miss. Bridget",female,24.0,Miss,0,0,0,1,7.75,Low,,T,Q,Unknown
1120,0,3,"Everett, Mr. Thomas James",male,40.5,Mr,0,0,0,1,15.1,High,,T,S,Adult
1121,0,2,"Hocking, Mr. Samuel James Metcalfe",male,36.0,Mr,0,0,0,1,13.0,Medium,,T,S,Adult
1122,0,2,"Sweet, Mr. George Frederick",male,14.0,Mr,0,0,0,1,65.0,Very High,,T,S,Teenager
1123,1,1,"Willard, Miss. Constance",female,21.0,Miss,0,0,0,1,26.55,High,,T,S,Young Adult
1124,0,3,"Wiklund, Mr. Karl Johan",male,21.0,Mr,0,1,0,2,6.4958,Low,,T,S,Young Adult
1125,0,3,"Linehan, Mr. Michael",male,25.0,Mr,0,0,0,1,7.8792,Low,,T,Q,Unknown
1126,0,1,"Cumings, Mr. John Bradley",male,39.0,Mr,0,1,0,2,71.2833,Very High,C85,C,C,Adult
1127,0,3,"Vendel, Mr. Olof Edvin",male,20.0,Mr,0,0,0,1,7.8542,Low,,T,S,Young Adult
1128,0,1,"Warren, Mr. Frank Manley",male,64.0,Mr,0,1,0,2,75.25,Very High,D37,D,C,Middle-aged
1129,0,3,"Baccos, Mr. Raffull",male,20.0,Mr,0,0,0,1,7.225,Low,,T,C,Young Adult
1130,1,2,"Hiltunen, Miss. Marta",female,18.0,Miss,0,1,1,3,13.0,Medium,,T,S,Teenager
1131,1,1,"Douglas, Mrs. Walter Donald (Mahala Dutton)",female,48.0,Mrs,1,1,0,2,106.425,Very High,C86,C,C,Adult
1132,1,1,"Lindstrom, Mrs. Carl Johan (Sigrid Posse)",female,55.0,Mrs,1,0,0,1,27.7208,High,,T,C,Middle-aged
1133,1,2,"Christy, Mrs. (Alice Frances)",female,45.0,Mrs,1,0,2,3,30.0,High,,T,S,Adult
1134,0,1,"Spedden, Mr. Frederic Oakley",male,45.0,Mr,0,1,1,3,134.5,Very High,E34,E,C,Adult
1135,0,3,"Hyman, Mr. Abraham",male,25.0,Mr,0,0,0,1,7.8875,Low,,T,S,Unknown
1136,0,3,"Johnston, Master. William Arthur Willie""""",male,25.0,Master,0,1,2,4,23.45,High,,T,S,Unknown
1137,0,1,"Kenyon, Mr. Frederick R",male,41.0,Mr,0,1,0,2,51.8625,Very High,D21,D,S,Adult
1138,1,2,"Karnes, Mrs. J Frank (Claire Bennett)",female,22.0,Mrs,1,0,0,1,21.0,High,,T,S,Young Adult
1139,0,2,"Drew, Mr. James Vivian",male,42.0,Mr,0,1,1,3,32.5,Very High,,T,S,Adult
1140,1,2,"Hold, Mrs. Stephen (Annie Margaret Hill)",female,29.0,Mrs,1,1,0,2,26.0,High,,T,S,Young Adult
1141,1,3,"Khalil, Mrs. Betros (Zahie Maria"" Elias)""",female,24.0,Mrs,1,1,0,2,14.4542,High,,T,C,Unknown
1142,1,2,"West, Miss. Barbara J",female,0.92,Miss,0,1,2,4,27.75,High,,T,S,Infant
1143,0,3,"Abrahamsson, Mr. Abraham August Johannes",male,20.0,Mr,0,0,0,1,7.925,Medium,,T,S,Young Adult
1144,0,1,"Clark, Mr. Walter Miller",male,27.0,Mr,0,1,0,2,136.7792,Very High,C89,C,C,Young Adult
1145,0,3,"Salander, Mr. Karl Johan",male,24.0,Mr,0,0,0,1,9.325,Medium,,T,S,Young Adult
1146,0,3,"Wenzel, Mr. Linhart",male,32.5,Mr,0,0,0,1,9.5,Medium,,T,S,Young Adult
1147,0,3,"MacKay, Mr. George William",male,25.0,Mr,0,0,0,1,7.55,Low,,T,S,Unknown
1148,0,3,"Mahon, Mr. John",male,25.0,Mr,0,0,0,1,7.75,Low,,T,Q,Unknown
1149,0,3,"Niklasson, Mr. Samuel",male,28.0,Mr,0,0,0,1,8.05,Medium,,T,S,Young Adult
1150,1,2,"Bentham, Miss. Lilian W",female,19.0,Miss,0,0,0,1,13.0,Medium,,T,S,Young Adult
1151,0,3,"Midtsjo, Mr. Karl Albert",male,21.0,Mr,0,0,0,1,7.775,Low,,T,S,Young Adult
1152,0,3,"de Messemaeker, Mr. Guillaume Joseph",male,36.5,Mr,0,1,0,2,17.4,High,,T,S,Adult
1153,0,3,"Nilsson, Mr. August Ferdinand",male,21.0,Mr,0,0,0,1,7.8542,Low,,T,S,Young Adult
1154,1,2,"Wells, Mrs. Arthur Henry (Addie"" Dart Trevaskis)""",female,29.0,Mrs,1,0,2,3,23.0,High,,T,S,Young Adult
1155,1,3,"Klasen, Miss. Gertrud Emilia",female,1.0,Miss,0,1,1,3,12.1833,Medium,,T,S,Infant
1156,0,2,"Portaluppi, Mr. Emilio Ilario Giuseppe",male,30.0,Mr,0,0,0,1,12.7375,Medium,,T,C,Young Adult
1157,0,3,"Lyntakoff, Mr. Stanko",male,25.0,Mr,0,0,0,1,7.8958,Low,,T,S,Unknown
1158,0,1,"Chisholm, Mr. Roderick Robert Crispin",male,40.0,Mr,0,0,0,1,0.0,Unknown,,T,S,Unknown
1159,0,3,"Warren, Mr. Charles William",male,25.0,Mr,0,0,0,1,7.55,Low,,T,S,Unknown
1160,1,3,"Howard, Miss. May Elizabeth",female,24.0,Miss,0,0,0,1,8.05,Medium,,T,S,Unknown
1161,0,3,"Pokrnic, Mr. Mate",male,17.0,Mr,0,0,0,1,8.6625,Medium,,T,S,Teenager
1162,0,1,"McCaffry, Mr. Thomas Francis",male,46.0,Mr,0,0,0,1,75.2417,Very High,C6,C,C,Adult
1163,0,3,"Fox, Mr. Patrick",male,25.0,Mr,0,0,0,1,7.75,Low,,T,Q,Unknown
1164,1,1,"Clark, Mrs. Walter Miller (Virginia McDowell)",female,26.0,Mrs,1,1,0,2,136.7792,Very High,C89,C,C,Young Adult
1165,1,3,"Lennon, Miss. Mary",female,24.0,Miss,0,1,0,2,15.5,High,,T,Q,Unknown
1166,0,3,"Saade, Mr. Jean Nassr",male,25.0,Mr,0,0,0,1,7.225,Low,,T,C,Unknown
1167,1,2,"Bryhl, Miss. Dagmar Jenny Ingeborg ",female,20.0,Miss,0,1,0,2,26.0,High,,T,S,Young Adult
1168,0,2,"Parker, Mr. Clifford Richard",male,28.0,Mr,0,0,0,1,10.5,Medium,,T,S,Young Adult
1169,0,2,"Faunthorpe, Mr. Harry",male,40.0,Mr,0,1,0,2,26.0,High,,T,S,Adult
1170,0,2,"Ware, Mr. John James",male,30.0,Mr,0,1,0,2,21.0,High,,T,S,Young Adult
1171,0,2,"Oxenham, Mr. Percy Thomas",male,22.0,Mr,0,0,0,1,10.5,Medium,,T,S,Young Adult
1172,1,3,"Oreskovic, Miss. Jelka",female,23.0,Miss,0,0,0,1,8.6625,Medium,,T,S,Young Adult
1173,0,3,"Peacock, Master. Alfred Edward",male,0.75,Master,0,1,1,3,13.775,Medium,,T,S,Infant
1174,1,3,"Fleming, Miss. Honora",female,24.0,Miss,0,0,0,1,7.75,Low,,T,Q,Unknown
1175,1,3,"Touma, Miss. Maria Youssef",female,9.0,Miss,0,1,1,3,15.2458,High,,T,C,Child
1176,1,3,"Rosblom, Miss. Salli Helena",female,2.0,Miss,0,1,1,3,20.2125,High,,T,S,Infant
1177,0,3,"Dennis, Mr. William",male,36.0,Mr,0,0,0,1,7.25,Low,,T,S,Adult
1178,0,3,"Franklin, Mr. Charles (Charles Fardon)",male,25.0,Mr,0,0,0,1,7.25,Low,,T,S,Unknown
1179,0,1,"Snyder, Mr. John Pillsbury",male,24.0,Mr,0,1,0,2,82.2667,Very High,B45,B,S,Young Adult
1180,0,3,"Mardirosian, Mr. Sarkis",male,25.0,Mr,0,0,0,1,7.2292,Low,F E46,F,C,Unknown
1181,0,3,"Ford, Mr. Arthur",male,25.0,Mr,0,0,0,1,8.05,Medium,,T,S,Unknown
1182,0,1,"Rheims, Mr. George Alexander Lucien",male,40.0,Mr,0,0,0,1,39.6,Very High,,T,S,Unknown
1183,1,3,"Daly, Miss. Margaret Marcella Maggie""""",female,30.0,Miss,0,0,0,1,6.95,Low,,T,Q,Young Adult
1184,0,3,"Nasr, Mr. Mustafa",male,25.0,Mr,0,0,0,1,7.2292,Low,,T,C,Unknown
1185,0,1,"Dodge, Dr. Washington",male,53.0,Dr,0,1,1,3,81.8583,Very High,A34,A,S,Middle-aged
1186,0,3,"Wittevrongel, Mr. Camille",male,36.0,Mr,0,0,0,1,9.5,Medium,,T,S,Adult
1187,0,3,"Angheloff, Mr. Minko",male,26.0,Mr,0,0,0,1,7.8958,Low,,T,S,Young Adult
1188,1,2,"Laroche, Miss. Louise",female,1.0,Miss,0,1,2,4,41.5792,Very High,,T,C,Infant
1189,0,3,"Samaan, Mr. Hanna",male,25.0,Mr,0,2,0,3,21.6792,High,,T,C,Unknown
1190,0,1,"Loring, Mr. Joseph Holland",male,30.0,Mr,0,0,0,1,45.5,Very High,,T,S,Young Adult
1191,0,3,"Johansson, Mr. Nils",male,29.0,Mr,0,0,0,1,7.8542,Low,,T,S,Young Adult
1192,0,3,"Olsson, Mr. Oscar Wilhelm",male,32.0,Mr,0,0,0,1,7.775,Low,,T,S,Young Adult
1193,0,2,"Malachard, Mr. Noel",male,18.5,Mr,0,0,0,1,15.0458,High,D,D,C,Unknown
1194,0,2,"Phillips, Mr. Escott Robert",male,43.0,Mr,0,0,1,2,21.0,High,,T,S,Adult
1195,0,3,"Pokrnic, Mr. Tome",male,24.0,Mr,0,0,0,1,8.6625,Medium,,T,S,Young Adult
1196,1,3,"McCarthy, Miss. Catherine Katie""""",female,24.0,Miss,0,0,0,1,7.75,Low,,T,Q,Unknown
1197,1,1,"Crosby, Mrs. Edward Gifford (Catherine Elizabeth Halstead)",female,64.0,Mrs,1,1,1,3,26.55,High,B26,B,S,Middle-aged
1198,0,1,"Allison, Mr. Hudson Joshua Creighton",male,30.0,Mr,0,1,2,4,151.55,Very High,C22 C26,C,S,Young Adult
1199,0,3,"Aks, Master. Philip Frank",male,0.83,Master,0,0,1,2,9.35,Medium,,T,S,Infant
1200,0,1,"Hays, Mr. Charles Melville",male,55.0,Mr,0,1,1,3,93.5,Very High,B69,B,S,Middle-aged
1201,1,3,"Hansen, Mrs. Claus Peter (Jennie L Howard)",female,45.0,Mrs,1,1,0,2,14.1083,Medium,,T,S,Adult
1202,0,3,"Cacic, Mr. Jego Grga",male,18.0,Mr,0,0,0,1,8.6625,Medium,,T,S,Teenager
1203,0,3,"Vartanian, Mr. David",male,22.0,Mr,0,0,0,1,7.225,Low,,T,C,Young Adult
1204,0,3,"Sadowitz, Mr. Harry",male,25.0,Mr,0,0,0,1,7.575,Low,,T,S,Unknown
1205,1,3,"Carr, Miss. Jeannie",female,37.0,Miss,0,0,0,1,7.75,Low,,T,Q,Adult
1206,1,1,"White, Mrs. John Stuart (Ella Holmes)",female,55.0,Mrs,1,0,0,1,135.6333,Very High,C32,C,C,Middle-aged
1207,1,3,"Hagardon, Miss. Kate",female,17.0,Miss,0,0,0,1,7.7333,Low,,T,Q,Teenager
1208,0,1,"Spencer, Mr. William Augustus",male,57.0,Mr,0,1,0,2,146.5208,Very High,B78,B,C,Middle-aged
1209,0,2,"Rogers, Mr. Reginald Harry",male,19.0,Mr,0,0,0,1,10.5,Medium,,T,S,Young Adult
1210,0,3,"Jonsson, Mr. Nils Hilding",male,27.0,Mr,0,0,0,1,7.8542,Low,,T,S,Young Adult
1211,0,2,"Jefferys, Mr. Ernest Wilfred",male,22.0,Mr,0,2,0,3,31.5,Very High,,T,S,Young Adult
1212,0,3,"Andersson, Mr. Johan Samuel",male,26.0,Mr,0,0,0,1,7.775,Low,,T,S,Young Adult
1213,0,3,"Krekorian, Mr. Neshan",male,25.0,Mr,0,0,0,1,7.2292,Low,F E57,F,C,Young Adult
1214,0,2,"Nesson, Mr. Israel",male,26.0,Mr,0,0,0,1,13.0,Medium,F2,F,S,Young Adult
1215,0,1,"Rowe, Mr. Alfred G",male,33.0,Mr,0,0,0,1,26.55,High,,T,S,Young Adult
1216,1,1,"Kreuchen, Miss. Emilie",female,39.0,Miss,0,0,0,1,211.3375,Very High,,T,S,Adult
1217,0,3,"Assam, Mr. Ali",male,23.0,Mr,0,0,0,1,7.05,Low,,T,S,Young Adult
1218,1,2,"Becker, Miss. Ruth Elizabeth",female,12.0,Miss,0,2,1,4,39.0,Very High,F4,F,S,Child
1219,0,1,"Rosenshine, Mr. George (Mr George Thorne"")""",male,46.0,Mr,0,0,0,1,79.2,Very High,,T,C,Adult
1220,0,2,"Clarke, Mr. Charles Valentine",male,29.0,Mr,0,1,0,2,26.0,High,,T,S,Young Adult
1221,0,2,"Enander, Mr. Ingvar",male,21.0,Mr,0,0,0,1,13.0,Medium,,T,S,Young Adult
1222,1,2,"Davies, Mrs. John Morgan (Elizabeth Agnes Mary White) ",female,48.0,Mrs,1,0,2,3,36.75,Very High,,T,S,Adult
1223,0,1,"Dulles, Mr. William Crothers",male,39.0,Mr,0,0,0,1,29.7,High,A18,A,C,Adult
1224,0,3,"Thomas, Mr. Tannous",male,25.0,Mr,0,0,0,1,7.225,Low,,T,C,Unknown
1225,1,3,"Nakid, Mrs. Said (Waika Mary"" Mowad)""",female,19.0,Mrs,1,1,1,3,15.7417,High,,T,C,Young Adult
1226,0,3,"Cor, Mr. Ivan",male,27.0,Mr,0,0,0,1,7.8958,Low,,T,S,Young Adult
1227,0,1,"Maguire, Mr. John Edward",male,30.0,Mr,0,0,0,1,26.0,High,C106,C,S,Young Adult
1228,0,2,"de Brito, Mr. Jose Joaquim",male,32.0,Mr,0,0,0,1,13.0,Medium,,T,S,Young Adult
1229,0,3,"Elias, Mr. Joseph",male,39.0,Mr,0,0,2,3,7.2292,Low,,T,C,Adult
1230,0,2,"Denbury, Mr. Herbert",male,25.0,Mr,0,0,0,1,31.5,Very High,,T,S,Young Adult
1231,0,3,"Betros, Master. Seman",male,25.0,Master,0,0,0,1,7.2292,Low,,T,C,Unknown
1232,0,2,"Fillbrook, Mr. Joseph Charles",male,18.0,Mr,0,0,0,1,10.5,Medium,,T,S,Teenager
1233,0,3,"Lundstrom, Mr. Thure Edvin",male,32.0,Mr,0,0,0,1,7.5792,Low,,T,S,Young Adult
1234,0,3,"Sage, Mr. John George",male,25.0,Mr,0,1,9,11,69.55,Very High,,T,S,Unknown
1235,1,1,"Cardeza, Mrs. James Warburton Martinez (Charlotte Wardle Drake)",female,58.0,Mrs,1,0,1,2,512.3292,Unknown,B51 B53 B55,B,C,Middle-aged
1236,0,3,"van Billiard, Master. James William",male,25.0,Master,0,1,1,3,14.5,High,,T,S,Unknown
1237,1,3,"Abelseth, Miss. Karen Marie",female,16.0,Miss,0,0,0,1,7.65,Low,,T,S,Teenager
1238,0,2,"Botsford, Mr. William Hull",male,26.0,Mr,0,0,0,1,13.0,Medium,,T,S,Young Adult
1239,1,3,"Whabee, Mrs. George Joseph (Shawneene Abi-Saab)",female,38.0,Mrs,1,0,0,1,7.2292,Low,,T,C,Adult
1240,0,2,"Giles, Mr. Ralph",male,24.0,Mr,0,0,0,1,13.5,Medium,,T,S,Young Adult
1241,1,2,"Walcroft, Miss. Nellie",female,31.0,Miss,0,0,0,1,21.0,High,,T,S,Young Adult
1242,1,1,"Greenfield, Mrs. Leo David (Blanche Strouse)",female,45.0,Mrs,1,0,1,2,63.3583,Very High,D10 D12,D,C,Adult
1243,0,2,"Stokes, Mr. Philip Joseph",male,25.0,Mr,0,0,0,1,10.5,Medium,,T,S,Young Adult
1244,0,2,"Dibden, Mr. William",male,18.0,Mr,0,0,0,1,73.5,Very High,,T,S,Teenager
1245,0,2,"Herman, Mr. Samuel",male,49.0,Mr,0,1,2,4,65.0,Very High,,T,S,Adult
1246,1,3,"Dean, Miss. Elizabeth Gladys Millvina""""",female,0.17,Miss,0,1,2,4,20.575,High,,T,S,Infant
1247,0,1,"Julian, Mr. Henry Forbes",male,50.0,Mr,0,0,0,1,26.0,High,E60,E,S,Adult
1248,1,1,"Brown, Mrs. John Murray (Caroline Lane Lamson)",female,59.0,Mrs,1,2,0,3,51.4792,Very High,C101,C,S,Middle-aged
1249,0,3,"Lockyer, Mr. Edward",male,25.0,Mr,0,0,0,1,7.8792,Low,,T,S,Unknown
1250,0,3,"O'Keefe, Mr. Patrick",male,25.0,Mr,0,0,0,1,7.75,Low,,T,Q,Unknown
1251,1,3,"Lindell, Mrs. Edvard Bengtsson (Elin Gerda Persson)",female,30.0,Mrs,1,1,0,2,15.55,High,,T,S,Young Adult
1252,0,3,"Sage, Master. William Henry",male,14.5,Master,0,8,2,11,69.55,Very High,,T,S,Teenager
1253,1,2,"Mallet, Mrs. Albert (Antoinette Magnin)",female,24.0,Mrs,1,1,1,3,37.0042,Very High,,T,C,Young Adult
1254,1,2,"Ware, Mrs. John James (Florence Louise Long)",female,31.0,Mrs,1,0,0,1,21.0,High,,T,S,Young Adult
1255,0,3,"Strilic, Mr. Ivan",male,27.0,Mr,0,0,0,1,8.6625,Medium,,T,S,Young Adult
1256,1,1,"Harder, Mrs. George Achilles (Dorothy Annan)",female,25.0,Mrs,1,1,0,2,55.4417,Very High,E50,E,C,Young Adult
1257,1,3,"Sage, Mrs. John (Annie Bullen)",female,24.0,Mrs,1,1,9,11,69.55,Very High,,T,S,Unknown
1258,0,3,"Caram, Mr. Joseph",male,25.0,Mr,0,1,0,2,14.4583,High,,T,C,Unknown
1259,1,3,"Riihivouri, Miss. Susanna Juhantytar Sanni""""",female,22.0,Miss,0,0,0,1,39.6875,Very High,,T,S,Young Adult
1260,1,1,"Gibson, Mrs. Leonard (Pauline C Boeson)",female,45.0,Mrs,1,0,1,2,59.4,Very High,,T,C,Adult
1261,0,2,"Pallas y Castello, Mr. Emilio",male,29.0,Mr,0,0,0,1,13.8583,Medium,,T,C,Young Adult
1262,0,2,"Giles, Mr. Edgar",male,21.0,Mr,0,1,0,2,11.5,Medium,,T,S,Young Adult
1263,1,1,"Wilson, Miss. Helen Alice",female,31.0,Miss,0,0,0,1,134.5,Very High,E39 E41,E,C,Young Adult
1264,0,1,"Ismay, Mr. Joseph Bruce",male,49.0,Mr,0,0,0,1,0.0,Unknown,B52 B54 B56,B,S,Adult
1265,0,2,"Harbeck, Mr. William H",male,44.0,Mr,0,0,0,1,13.0,Medium,,T,S,Adult
1266,1,1,"Dodge, Mrs. Washington (Ruth Vidaver)",female,54.0,Mrs,1,1,1,3,81.8583,Very High,A34,A,S,Middle-aged
1267,1,1,"Bowen, Miss. Grace Scott",female,45.0,Miss,0,0,0,1,262.375,Very High,,T,C,Adult
