PassengerId,Survived,Pclass,Name,Sex,Age,Title,IsMarried,SibSp,Parch,FamilySize,Fare,FareGroup,Cabin,Deck,Embarked,AgeGroup
1268,1,3,"Kink, Miss. Maria",female,22.0,Miss,0,2,0,3,8.6625,Medium,,T,S,Young Adult
1269,0,2,"Cotterill, Mr. Henry Harry""""",male,21.0,Mr,0,0,0,1,11.5,Medium,,T,S,Young Adult
1270,0,1,"Hipkins, Mr. William Edward",male,55.0,Mr,0,0,0,1,50.0,Very High,C39,C,S,Middle-aged
1271,0,3,"Asplund, Master. Carl Edgar",male,5.0,Master,0,4,2,7,31.3875,Very High,,T,S,Child
1272,0,3,"O'Connor, Mr. Patrick",male,25.0,Mr,0,0,0,1,7.75,Low,,T,Q,Unknown
1273,0,3,"Foley, Mr. Joseph",male,26.0,Mr,0,0,0,1,7.8792,Low,,T,Q,Young Adult
1274,1,3,"Risien, Mrs. Samuel (Emma)",female,24.0,Mrs,1,0,0,1,14.5,High,,T,S,Unknown
1275,1,3,"McNamee, Mrs. Neal (Eileen O'Leary)",female,19.0,Mrs,1,1,0,2,16.1,High,,T,S,Young Adult
1276,0,2,"Wheeler, Mr. Edwin Frederick""""",male,18.5,Mr,0,0,0,1,12.875,Medium,,T,S,Unknown
1277,1,2,"Herman, Miss. Kate",female,24.0,Miss,0,1,2,4,65.0,Very High,,T,S,Young Adult
1278,0,3,"Aronsson, Mr. Ernst Axel Algot",male,24.0,Mr,0,0,0,1,7.775,Low,,T,S,Young Adult
1279,0,2,"Ashby, Mr. John",male,57.0,Mr,0,0,0,1,13.0,Medium,,T,S,Middle-aged
1280,0,3,"Canavan, Mr. Patrick",male,21.0,Mr,0,0,0,1,7.75,Low,,T,Q,Young Adult
1281,0,3,"Palsson, Master. Paul Folke",male,6.0,Master,0,3,1,5,21.075,High,,T,S,Child
1282,0,1,"Payne, Mr. Vivian Ponsonby",male,23.0,Mr,0,0,0,1,93.5,Very High,B24,B,S,Young Adult
1283,1,1,"Lines, Mrs. Ernest H (Elizabeth Lindsey James)",female,51.0,Mrs,1,0,1,2,39.4,Very High,D28,D,S,Middle-aged
1284,0,3,"Abbott, Master. Eugene Joseph",male,13.0,Master,0,0,2,3,20.25,High,,T,S,Teenager
1285,0,2,"Gilbert, Mr. William",male,47.0,Mr,0,0,0,1,10.5,Medium,,T,S,Adult
1286,0,3,"Kink-Heilmann, Mr. Anton",male,29.0,Mr,0,3,1,5,22.025,High,,T,S,Young Adult
1287,1,1,"Smith, Mrs. Lucien Philip (Mary Eloise Hughes)",female,18.0,Mrs,1,1,0,2,60.0,Very High,C31,C,S,Teenager
1288,0,3,"Colbert, Mr. Patrick",male,24.0,Mr,0,0,0,1,7.25,Low,,T,Q,Young Adult
1289,1,1,"Frolicher-Stehli, Mrs. Maxmillian (Margaretha Emerentia Stehli)",female,48.0,Mrs,1,1,1,3,79.2,Very High,B41,B,C,Adult
1290,0,3,"Larsson-Rondberg, Mr. Edvard A",male,22.0,Mr,0,0,0,1,7.775,Low,,T,S,Young Adult
1291,0,3,"Conlon, Mr. Thomas Henry",male,31.0,Mr,0,0,0,1,7.7333,Low,,T,Q,Young Adult
1292,1,1,"Bonnell, Miss. Caroline",female,30.0,Miss,0,0,0,1,164.8667,Very High,C7,C,S,Young Adult
1293,0,2,"Gale, Mr. Harry",male,38.0,Mr,0,1,0,2,21.0,High,,T,S,Adult
1294,1,1,"Gibson, Miss. Dorothy Winifred",female,22.0,Miss,0,0,1,2,59.4,Very High,,T,C,Young Adult
1295,0,1,"Carrau, Mr. Jose Pedro",male,17.0,Mr,0,0,0,1,47.1,Very High,,T,S,Teenager
1296,0,1,"Frauenthal, Mr. Isaac Gerald",male,43.0,Mr,0,1,0,2,27.7208,High,D40,D,C,Adult
1297,0,2,"Nourney, Mr. Alfred (Baron von Drachstedt"")""",male,20.0,Mr,0,0,0,1,13.8625,Medium,D38,D,C,Young Adult
1298,0,2,"Ware, Mr. William Jeffery",male,23.0,Mr,0,1,0,2,10.5,Medium,,T,S,Young Adult
1299,0,1,"Widener, Mr. George Dunton",male,50.0,Mr,0,1,1,3,211.5,Very High,C80,C,C,Adult
1300,1,3,"Riordan, Miss. Johanna Hannah""""",female,24.0,Miss,0,0,0,1,7.7208,Low,,T,Q,Unknown
1301,1,3,"Peacock, Miss. Treasteall",female,3.0,Miss,0,1,1,3,13.775,Medium,,T,S,Child
1302,1,3,"Naughton, Miss. Hannah",female,24.0,Miss,0,0,0,1,7.75,Low,,T,Q,Unknown
1303,1,1,"Minahan, Mrs. William Edward (Lillian E Thorpe)",female,37.0,Mrs,1,1,0,2,90.0,Very High,C78,C,Q,Adult
1304,1,3,"Henriksson, Miss. Jenny Lovisa",female,28.0,Miss,0,0,0,1,7.775,Low,,T,S,Young Adult
1305,0,3,"Spector, Mr. Woolf",male,25.0,Mr,0,0,0,1,8.05,Medium,,T,S,Unknown
1306,1,1,"Oliva y Ocana, Dona. Fermina",female,39.0,Dona,0,0,0,1,108.9,Very High,C105,C,C,Adult
1307,0,3,"Saether, Mr. Simon Sivertsen",male,38.5,Mr,0,0,0,1,7.25,Low,,T,S,Adult
1308,0,3,"Ware, Mr. Frederick",male,25.0,Mr,0,0,0,1,8.05,Medium,,T,S,Unknown
1309,0,3,"Peter, Master. Michael J",male,25.0,Master,0,1,1,3,22.3583,High,,T,C,Unknown